{
  "formatVersion": 1,
  "defaultVariant": "standard_quality",
  "transform": {
    "position": [
      0,
      0,
      0
    ],
    "rotation": [
      0,
      0,
      0
    ],
    "scale": [
      1,
      1,
      1
    ]
  },
  "settings": "media_and_settings/wedding_settings.json",
  "poster": "media_and_settings/wedding_1205.jpg",
  "audio": "media_and_settings/wedding.wav",
  "preview": "media_and_settings/wedding.webm",
  "variants": [
    {
      "id": "standard_quality",
      "name": "标准画质",
      "format": "4dv-compressed-ply",
      "segments": [
        {
          "path": "standard_quality/00.c.ply",
          "startSeconds": 0,
          "durationSeconds": 5
        },
        {
          "path": "standard_quality/01.c.ply",
          "startSeconds": 5,
          "durationSeconds": 3
        }
      ]
    },
    {
      "id": "high_quality",
      "name": "高清画质",
      "format": "4dv-compressed-ply",
      "segments": [
        {
          "path": "high_quality/00.c.ply",
          "startSeconds": 0,
          "durationSeconds": 5
        },
        {
          "path": "high_quality/01.c.ply",
          "startSeconds": 5,
          "durationSeconds": 3
        }
      ]
    },
    {
      "id": "vr_foreground",
      "name": "VR 前景",
      "format": "4dv-compressed-ply",
      "segments": [
        {
          "path": "vr_foreground/00.c.ply",
          "startSeconds": 0,
          "durationSeconds": 5
        },
        {
          "path": "vr_foreground/01.c.ply",
          "startSeconds": 5,
          "durationSeconds": 3
        }
      ]
    }
  ]
}